<?xml version="1.0" encoding="UTF-8" ?>
        <!--

               Copyright 2009-2017 the original author or authors.

               Licensed under the Apache License, Version 2.0 (the "License");
               you may not use it file except in compliance with the License.
               You may obtain a copy of the License at

                  http://www.apache.org/licenses/LICENSE-2.0

               Unless required by applicable law or agreed to in writing, software
               distributed under the License is distributed on an "AS IS" BASIS,
               WITHOUT WARRANTIES OR CONDITIONS OF ANY KIND, either express or implied.
               See the License for the specific language governing permissions and
               limitations under the License.

        -->
        <!ELEMENT mapper (cache-ref | cache | resultMap* | parameterMap* | sql* | insert* | update* |updateTemplete* | delete* |deleteTemplete* | select* | selectTemplete* | insertTemplete* )+>
        <!ATTLIST mapper
                >

        <!ELEMENT cache-ref EMPTY>
        <!ATTLIST cache-ref
                namespace CDATA #REQUIRED
                >

        <!ELEMENT cache (property*)>
        <!ATTLIST cache
                type CDATA #IMPLIED
                eviction CDATA #IMPLIED
                flushInterval CDATA #IMPLIED
                size CDATA #IMPLIED
                readOnly CDATA #IMPLIED
                blocking CDATA #IMPLIED
                >

        <!ELEMENT parameterMap (parameter+)?>
        <!ATTLIST parameterMap
                id CDATA #REQUIRED
                type CDATA #REQUIRED
                >

        <!ELEMENT parameter EMPTY>
        <!ATTLIST parameter
                property CDATA #REQUIRED
                langType CDATA #IMPLIED
                <!--jdbcType CDATA #IMPLIED-->
                mode (IN | OUT | INOUT) #IMPLIED
                resultMap CDATA #IMPLIED
                scale CDATA #IMPLIED
                typeHandler CDATA #IMPLIED
                >

        <!ELEMENT resultMap (constructor?,id*,result*,association*,collection*, discriminator?)>
        <!ATTLIST resultMap
                id CDATA #REQUIRED
                extends CDATA #IMPLIED
                autoMapping (true|false) #IMPLIED
                >

        <!ELEMENT constructor (idArg*,arg*)>

        <!ELEMENT id EMPTY>
        <!ATTLIST id
                property CDATA #IMPLIED
                langType CDATA #IMPLIED
                column CDATA #IMPLIED
                <!--jdbcType CDATA #IMPLIED-->
                typeHandler CDATA #IMPLIED
                >

        <!ELEMENT result EMPTY>
        <!ATTLIST result
                property CDATA #IMPLIED
                langType CDATA #IMPLIED
                column CDATA #IMPLIED

                version_enable CDATA #IMPLIED
                logic_enable CDATA #IMPLIED
                logic_deleted CDATA #IMPLIED
                logic_undelete CDATA #IMPLIED
                <!--jdbcType CDATA #IMPLIED-->
                typeHandler CDATA #IMPLIED
                >

        <!ELEMENT idArg EMPTY>
        <!ATTLIST idArg
                langType CDATA #IMPLIED
                column CDATA #IMPLIED
                <!--jdbcType CDATA #IMPLIED-->
                typeHandler CDATA #IMPLIED
                select CDATA #IMPLIED
                resultMap CDATA #IMPLIED
                name CDATA #IMPLIED
                >

        <!ELEMENT arg EMPTY>
        <!ATTLIST arg
                langType CDATA #IMPLIED
                column CDATA #IMPLIED
                <!--jdbcType CDATA #IMPLIED-->
                typeHandler CDATA #IMPLIED
                select CDATA #IMPLIED
                resultMap CDATA #IMPLIED
                name CDATA #IMPLIED
                >

        <!ELEMENT collection (constructor?,id*,result*,association*,collection*, discriminator?)>
        <!ATTLIST collection
                property CDATA #REQUIRED
                column CDATA #IMPLIED
                langType CDATA #IMPLIED
                ofType CDATA #IMPLIED
                <!--jdbcType CDATA #IMPLIED-->
                select CDATA #IMPLIED
                resultMap CDATA #IMPLIED
                typeHandler CDATA #IMPLIED
                notNullColumn CDATA #IMPLIED
                columnPrefix CDATA #IMPLIED
                resultSet CDATA #IMPLIED
                foreignColumn CDATA #IMPLIED
                autoMapping (true|false) #IMPLIED
                fetchType (lazy|eager) #IMPLIED
                >

        <!ELEMENT association (constructor?,id*,result*,association*,collection*, discriminator?)>
        <!ATTLIST association
                property CDATA #REQUIRED
                column CDATA #IMPLIED
                langType CDATA #IMPLIED
                <!--jdbcType CDATA #IMPLIED-->
                select CDATA #IMPLIED
                resultMap CDATA #IMPLIED
                typeHandler CDATA #IMPLIED
                notNullColumn CDATA #IMPLIED
                columnPrefix CDATA #IMPLIED
                resultSet CDATA #IMPLIED
                foreignColumn CDATA #IMPLIED
                autoMapping (true|false) #IMPLIED
                fetchType (lazy|eager) #IMPLIED
                >

        <!ELEMENT discriminator (case+)>
        <!ATTLIST discriminator
                column CDATA #IMPLIED
                langType CDATA #REQUIRED
                <!--jdbcType CDATA #IMPLIED-->
                typeHandler CDATA #IMPLIED
                >

        <!ELEMENT case (constructor?,id*,result*,association*,collection*, discriminator?)>
        <!ATTLIST case
                value CDATA #REQUIRED
                resultMap CDATA #IMPLIED
                resultType CDATA #IMPLIED
                >

        <!ELEMENT property EMPTY>
        <!ATTLIST property
                name CDATA #REQUIRED
                value CDATA #REQUIRED
                >

        <!ELEMENT typeAlias EMPTY>
        <!ATTLIST typeAlias
                alias CDATA #REQUIRED
                type CDATA #REQUIRED
                >

        <!ELEMENT select (#PCDATA | include | trim | where | set | foreach | choose | if | bind)*>
        <!ATTLIST select
                id CDATA #REQUIRED
                parameterMap CDATA #IMPLIED
                parameterType CDATA #IMPLIED
                resultMap CDATA #IMPLIED
                resultType CDATA #IMPLIED
                
               
                fetchSize CDATA #IMPLIED
                timeout CDATA #IMPLIED
                flushCache (true|false) #IMPLIED
                useCache (true|false) #IMPLIED
                
                lang CDATA #IMPLIED
                
                
                >

        <!ELEMENT selectTemplete (#PCDATA | include | trim | where | set | foreach | choose | if | bind)*>
        <!ATTLIST selectTemplete
                id CDATA #IMPLIED
                parameterMap CDATA #IMPLIED
                parameterType CDATA #IMPLIED
                resultMap (BaseResultMap) #IMPLIED
                resultType CDATA #IMPLIED


                fetchSize CDATA #IMPLIED
                timeout CDATA #IMPLIED
                flushCache (true|false) #IMPLIED
                useCache (true|false) #IMPLIED

                lang CDATA #IMPLIED


                tables CDATA #REQUIRED
                columns CDATA #IMPLIED
                wheres CDATA #IMPLIED
                >


        <!ELEMENT insert (#PCDATA | selectKey | include | trim | where | set | foreach | choose | if | bind)*>
        <!ATTLIST insert
                id CDATA #REQUIRED
                parameterMap CDATA #IMPLIED
                parameterType CDATA #IMPLIED
                timeout CDATA #IMPLIED
                flushCache (true|false) #IMPLIED
               
                
                useGeneratedKeys (true|false) #IMPLIED
                
                
                lang CDATA #IMPLIED
                >

        <!ELEMENT insertTemplete (#PCDATA | selectKey | include | trim | where | set | foreach | choose | if | bind)*>
        <!ATTLIST insertTemplete
                id CDATA #IMPLIED
                resultMap CDATA #IMPLIED
                tables CDATA #REQUIRED
                inserts CDATA #IMPLIED
                resultMap (BaseResultMap) #IMPLIED
                >

        <!ELEMENT selectKey (#PCDATA | include | trim | where | set | foreach | choose | if | bind)*>
        <!ATTLIST selectKey
                resultType CDATA #IMPLIED
               
                
                
                order (BEFORE|AFTER) #IMPLIED
                
                >

        <!ELEMENT update (#PCDATA | selectKey | include | trim | where | set | foreach | choose | if | bind)*>
        <!ATTLIST update
                id CDATA #REQUIRED
                parameterMap CDATA #IMPLIED
                parameterType CDATA #IMPLIED
                timeout CDATA #IMPLIED
                flushCache (true|false) #IMPLIED
               
                
                useGeneratedKeys (true|false) #IMPLIED
                
                
                lang CDATA #IMPLIED
                >
        <!ELEMENT updateTemplete (#PCDATA | selectKey | include | trim | where | set | foreach | choose | if | bind)*>
        <!ATTLIST updateTemplete
                id CDATA #IMPLIED
                parameterMap CDATA #IMPLIED
                parameterType CDATA #IMPLIED
                timeout CDATA #IMPLIED
                flushCache (true|false) #IMPLIED
                resultMap (BaseResultMap) #IMPLIED

                useGeneratedKeys (true|false) #IMPLIED


                lang CDATA #IMPLIED
                tables CDATA #REQUIRED
                sets CDATA #IMPLIED
                wheres CDATA #IMPLIED
                >

        <!ELEMENT delete (#PCDATA | include | trim | where | set | foreach | choose | if | bind)*>
        <!ATTLIST delete
                id CDATA #REQUIRED
                parameterMap CDATA #IMPLIED
                parameterType CDATA #IMPLIED
                timeout CDATA #IMPLIED
                flushCache (true|false) #IMPLIED
               
                
                lang CDATA #IMPLIED
                >
        <!ELEMENT deleteTemplete (#PCDATA | include | trim | where | set | foreach | choose | if | bind)*>
        <!ATTLIST deleteTemplete
                id CDATA #IMPLIED
                parameterMap CDATA #IMPLIED
                parameterType CDATA #IMPLIED
                timeout CDATA #IMPLIED
                flushCache (true|false) #IMPLIED


                lang CDATA #IMPLIED
                tables CDATA #REQUIRED
                wheres CDATA #IMPLIED
                resultMap (BaseResultMap) #IMPLIED
                >
        <!-- Dynamic -->

        <!ELEMENT include (property+)?>
        <!ATTLIST include
                refid CDATA #REQUIRED
                >

        <!ELEMENT bind EMPTY>
        <!ATTLIST bind
                name CDATA #REQUIRED
                value CDATA #REQUIRED
                >

        <!ELEMENT sql (#PCDATA | include | trim | where | set | foreach | choose | if | bind)*>
        <!ATTLIST sql
                id CDATA #REQUIRED
                lang CDATA #IMPLIED
                
                >

        <!ELEMENT trim (#PCDATA | include | trim | where | set | foreach | choose | if | bind)*>
        <!ATTLIST trim
                prefix CDATA #IMPLIED
                prefixOverrides CDATA #IMPLIED
                suffix CDATA #IMPLIED
                suffixOverrides CDATA #IMPLIED
                >
        <!ELEMENT where (#PCDATA | include | trim | where | set | foreach | choose | if | bind)*>
        <!ELEMENT set (#PCDATA | include | trim | where | set | foreach | choose | if | bind)*>

        <!ELEMENT foreach (#PCDATA | include | trim | where | set | foreach | choose | if | bind)*>
        <!ATTLIST foreach
                collection CDATA #REQUIRED
                item CDATA #IMPLIED
                index CDATA #IMPLIED
                open CDATA #IMPLIED
                close CDATA #IMPLIED
                separator CDATA #IMPLIED
                >

        <!ELEMENT choose (when* , otherwise?)>
        <!ELEMENT when (#PCDATA | include | trim | where | set | foreach | choose | if | bind)*>
        <!ATTLIST when
                test CDATA #REQUIRED
                >
        <!ELEMENT otherwise (#PCDATA | include | trim | where | set | foreach | choose | if | bind)*>

        <!ELEMENT if (#PCDATA | include | trim | where | set | foreach | choose | if | bind)*>
        <!ATTLIST if
                test CDATA #REQUIRED
                >


